[
  {
    "slug": "federal-american-eagle-9mm-250",
    "title": "Federal American Eagle 9mm 115gr FMJ — 250 rounds",
    "merchant": "Target Sports USA",
    "price_now": 64.99,
    "price_was": 89.99,
    "category": "ammo",
    "why": "About 26¢ a round for brass-case FMJ. Big-box counters have been closer to 36¢ on the same 250-round pack.",
    "url": "https://www.targetsportsusa.com/federal-american-eagle-9mm-ammo-115-grain-ammo-full-metal-jacket-ae9dp-p-660.aspx",
    "image": "images/deals/federal-american-eagle-9mm-250.jpg",
    "curated": true,
    "posted": "2026-09-21"
  },
  {
    "slug": "anker-521-power-station",
    "title": "Anker 521 Portable Power Station (256Wh)",
    "merchant": "Anker",
    "price_now": 199.0,
    "price_was": 299.99,
    "category": "household",
    "why": "Enough stored power for phones, a radio, and a small fan. Anker’s own price has been sitting near $280.",
    "url": "https://www.ankersolix.com/ca/products/521",
    "image": "images/deals/anker-521-power-station.jpg",
    "curated": true,
    "posted": "2026-09-21"
  },
  {
    "slug": "glock-19-gen5-mos",
    "title": "Glock 19 Gen5 MOS 9mm",
    "merchant": "Palmetto State Armory",
    "price_now": 499.0,
    "price_was": 649.0,
    "category": "guns",
    "why": "Department trade-in Gen5 MOS pistols still list nearer $620 when sold as new. A used police trade-in under $500 is the one that sells through.",
    "url": "https://palmettostatearmory.com/glock-19-mos-gen-5-pistol-with-front-serrations-black-pa195s203m.html",
    "tags": ["police-trade-in", "used"],
    "curated": true,
    "posted": "2026-09-20"
  },
  {
    "slug": "streamlight-protac-hl-x",
    "title": "Streamlight ProTac HL-X",
    "merchant": "MidwayUSA",
    "price_now": 89.99,
    "price_was": 139.99,
    "category": "accessories",
    "why": "The default 1,000-lumen weapon light on a lot of builds. A used HL-X under $90 sits below the usual street price for a new one.",
    "url": "https://www.midwayusa.com/product/1018571930",
    "image": "images/deals/streamlight-protac-hl-x.jpg",
    "tags": ["used"],
    "curated": true,
    "posted": "2026-09-20"
  },
  {
    "slug": "holosun-hs403b",
    "title": "Holosun HS403B Micro Red Dot",
    "merchant": "Primary Arms",
    "price_now": 149.99,
    "price_was": 229.99,
    "category": "optics",
    "why": "Agency trade-in of the usual first red dot. It has not spent much time this far under $200.",
    "url": "https://www.primaryarms.com/search?q=Holosun+HS403B",
    "tags": ["police-trade-in"],
    "curated": true,
    "posted": "2026-09-19"
  },
  {
    "slug": "lifestraw-personal",
    "title": "LifeStraw Personal Water Filter",
    "merchant": "REI",
    "price_now": 14.95,
    "price_was": 19.95,
    "category": "survival",
    "why": "A small dollar cut on a filter whose shelf price barely moves. Easy spare for a glovebox or day pack.",
    "url": "https://www.rei.com/b/lifestraw/c/straw-water-filters",
    "curated": false,
    "posted": "2026-09-19"
  },
  {
    "slug": "augason-farms-30-day",
    "title": "Augason Farms 30-Day Emergency Food Kit",
    "merchant": "Emergency Essentials",
    "price_now": 119.0,
    "price_was": 184.99,
    "category": "food-storage",
    "why": "A one-person 30-day bucket under $120. The same kit has been listing closer to $170.",
    "url": "https://www.beprepared.com/products/emergency-food-supply-30-days",
    "image": "images/deals/augason-farms-30-day.jpg",
    "curated": true,
    "posted": "2026-09-18"
  },
  {
    "slug": "hornady-critical-defense-9mm-25",
    "title": "Hornady Critical Defense 9mm 115gr — 25 rounds",
    "merchant": "MidwayUSA",
    "price_now": 22.49,
    "price_was": 32.99,
    "category": "ammo",
    "why": "Defensive 9mm rarely prints under $1 a round. This box does, and it is not tied to a bulk-club login.",
    "url": "https://www.midwayusa.com/product/100157068",
    "image": "images/deals/hornady-critical-defense-9mm-25.jpg",
    "curated": false,
    "posted": "2026-09-18"
  },
  {
    "slug": "ruger-10-22-carbine",
    "title": "Ruger 10/22 Carbine .22 LR",
    "merchant": "Sportsman's Warehouse",
    "price_now": 229.99,
    "price_was": 309.99,
    "category": "guns",
    "why": "Used wood-stock carbine, not a rebate bundle. Everyday new pricing has been stuck just over $300.",
    "url": "https://www.sportsmans.com/shooting-gear-gun-supplies/rifles/ruger-1022-carbine-22-long-rifle-satin-blackhardwood-semi-automatic-rifle-185in/p/301829",
    "image": "images/deals/ruger-10-22-carbine.jpg",
    "tags": ["used"],
    "curated": false,
    "posted": "2026-09-17"
  },
  {
    "slug": "sol-emergency-bivvy-2-pack",
    "title": "SOL Emergency Bivvy — 2 pack",
    "merchant": "REI",
    "price_now": 29.95,
    "price_was": 49.9,
    "category": "survival",
    "why": "Two heat-reflective bivvies for the price one usually costs. Worth a slot in a vehicle kit before cold weather.",
    "url": "https://www.rei.com/product/813511/sol-emergency-bivy",
    "curated": true,
    "posted": "2026-09-17"
  },
  {
    "slug": "magpul-pmag-30-gen-m3-10-pack",
    "title": "Magpul PMAG 30 AR/M4 Gen M3 — 10 pack",
    "merchant": "Brownells",
    "price_now": 99.95,
    "price_was": 149.95,
    "category": "accessories",
    "why": "Ten magazines at about $10 each. Sold one at a time, the same Gen M3 still rings up near $15.",
    "url": "https://www.brownells.com/gun-parts/magazines/rifle-magazines-parts/ar-15-30rd-pmag-gen-m3-magazine-2235.56/",
    "curated": false,
    "posted": "2026-09-16"
  },
  {
    "slug": "smith-wesson-mp15-sport-iii",
    "title": "Smith & Wesson M&P15 Sport III 5.56",
    "merchant": "GrabAGun",
    "price_now": 679.0,
    "price_was": 849.99,
    "category": "guns",
    "why": "Sport III rifles have been sticky around $800 new. This one is a police trade-in, not a blemished new gun.",
    "url": "https://grabagun.com/smith-and-wesson-m-p15-sport-iii-5-56-223-rem-16-barrel-30-rounds.html",
    "tags": ["police-trade-in"],
    "curated": false,
    "posted": "2026-09-15"
  },
  {
    "slug": "vortex-diamondback-4-12x40",
    "title": "Vortex Diamondback 4-12x40 BDC",
    "merchant": "OpticsPlanet",
    "price_now": 199.99,
    "price_was": 299.99,
    "category": "optics",
    "why": "A third off a Diamondback that still carries Vortex VIP warranty. MAP has been keeping street prices nearer $260.",
    "url": "https://www.opticsplanet.com/vortex-riflescopes-dbk-m-04p.html",
    "curated": false,
    "posted": "2026-09-14"
  },
  {
    "slug": "mountain-house-classic-bucket",
    "title": "Mountain House Classic Bucket — 24 servings",
    "merchant": "Walmart",
    "price_now": 79.0,
    "price_was": 114.99,
    "category": "food-storage",
    "why": "Just over $3 a serving for freeze-dried entrees with a long shelf life. Recent club pricing has been nearer $4.50.",
    "url": "https://www.walmart.com/ip/Mountain-House-Freeze-Dried-Emergency-Food-Pouche-12-Count/412259451",
    "curated": false,
    "posted": "2026-09-13"
  },
  {
    "slug": "winchester-556-m193-150",
    "title": "Winchester 5.56 55gr M193 — 150 rounds",
    "merchant": "Brownells",
    "price_now": 89.0,
    "price_was": 124.99,
    "category": "ammo",
    "why": "About 59¢ a round for M193-style brass. Recent case splits have been closer to 75¢.",
    "url": "https://www.brownells.com/ammunition/rifle-ammunition/usa-white-box-5.56mm-rifle-ammo/",
    "curated": false,
    "posted": "2026-09-12"
  },
  {
    "slug": "sig-romeo5",
    "title": "Sig Sauer Romeo5 1x20mm",
    "merchant": "Palmetto State Armory",
    "price_now": 129.99,
    "price_was": 189.99,
    "category": "optics",
    "why": "New Romeo5 street price has settled around $160. This used unit is under that, and it is not a parts gun.",
    "url": "https://palmettostatearmory.com/sig-sauer-romeo5-1x20mm-red-dot-sight-black-r52001.html",
    "tags": ["used"],
    "curated": false,
    "posted": "2026-09-11"
  },
  {
    "slug": "adventure-medical-sportsman-200",
    "title": "Adventure Medical Kits Sportsman 200",
    "merchant": "REI",
    "price_now": 24.0,
    "price_was": 36.0,
    "category": "survival",
    "why": "A compact kit for blisters, cuts, and the small stuff. Replacing the contents one packet at a time costs more than the kit.",
    "url": "https://www.rei.com/b/adventure-medical-kits/c/first-aid-kits",
    "curated": false,
    "posted": "2026-09-10"
  },
  {
    "slug": "blue-force-gear-vickers-sling",
    "title": "Blue Force Gear Vickers Combat Sling",
    "merchant": "Primary Arms",
    "price_now": 42.0,
    "price_was": 65.0,
    "category": "accessories",
    "why": "Padded Vickers slings rarely print under $55. This is the standard black sling, not a closeout colorway.",
    "url": "https://www.primaryarms.com/blue-force-gear-vickers-padded-push-button-sling-black",
    "image": "images/deals/blue-force-gear-vickers-sling.jpg",
    "curated": false,
    "posted": "2026-09-09"
  },
  {
    "slug": "packfreshusa-mylar-gallon-50",
    "title": "PackFreshUSA 1-Gallon Mylar Bags with Oxygen Absorbers — 50",
    "merchant": "PackFreshUSA",
    "price_now": 34.95,
    "price_was": 49.95,
    "category": "food-storage",
    "why": "Bags and absorbers in one carton for dry staples. Buying the two pieces separately has been landing near $50.",
    "url": "https://packfreshusa.com/gallon-7-mil-premium-century-mylar-bags-and-oxygen-absorbers/",
    "image": "images/deals/packfreshusa-mylar-gallon-50.jpg",
    "curated": false,
    "posted": "2026-09-08"
  },
  {
    "slug": "black-decker-20v-drill-kit",
    "title": "BLACK+DECKER 20V MAX Drill/Driver Kit",
    "merchant": "Home Depot",
    "price_now": 59.0,
    "price_was": 99.0,
    "category": "household",
    "why": "Battery, charger, and a basic household drill at 40% off. It is a home kit, not a jobsite driver.",